{"schema_version":"2.0","candidate_id":"det_conversion_demo","window":{"start":"2026-08-30T10:00:00Z","end":"2026-08-30T11:00:00Z"},"slice":{"provider_id":"ADYEN","currency":"BRL"},"metric":"PAYMENT_CONVERSION","observed":0.55,"expected":0.82,"sample_size":20,"estimated_lost_conversions":5.4,"evidence_refs":["window://corr_demo","baseline://global/3-windows"],"detector_version":"1.0","correlation_id":"corr_demo"}
